{
  "$schema": "https://json-schema.org/draft/2020-12/schema",
  "$id": "urn:agent-fabric:role-catalog",
  "title": "The reusable role catalogue",
  "description": "identities/roles/catalog.json: every role agent-fabric knows, by id. A role is a reusable identity — a charter, an authority boundary, a way of working — independent of any project and of any agent that happens to hold it. Where a role applies inside a managed repository is a project binding (projects/<id>/taxonomy.json), not a property of the role.",
  "type": "object",
  "required": [
    "version",
    "roles"
  ],
  "additionalProperties": false,
  "properties": {
    "version": {
      "type": "integer",
      "minimum": 1
    },
    "description": {
      "type": "string"
    },
    "groups": {
      "type": "array",
      "minItems": 1,
      "uniqueItems": true,
      "items": {
        "type": "string",
        "minLength": 1
      },
      "description": "A starting layout for Fleet Deck, the operator's console: the groups it seeds when it is first set up on a host. Only a seed: the operator arranges the deck as they like afterwards, and nothing re-applies or checks this."
    },
    "roles": {
      "type": "array",
      "minItems": 1,
      "items": {
        "type": "object",
        "required": [
          "id",
          "title"
        ],
        "additionalProperties": false,
        "properties": {
          "id": {
            "type": "string",
            "pattern": "^[a-z][a-z0-9-]*$",
            "description": "The slug: names identities/roles/<id>/ and goes on the wire as ROLE."
          },
          "title": {
            "type": "string"
          },
          "short_title": {
            "type": "string",
            "minLength": 1,
            "description": "The role as people read it beside an agent's name: AI <First> <Surname>, <short_title> (agent-fabric ADR-056 §5 rule 2)."
          },
          "candidate": {
            "type": "boolean",
            "description": "True while the cluster has not yet proved it carries its own weight."
          },
          "group": {
            "type": "string",
            "description": "The group of `groups` a new host's Fleet Deck starts this role's agents in; a seed, never enforced."
          },
          "holders_specialize": {
            "enum": [
              "optional",
              "required"
            ],
            "description": "Whether a holder of this role launches only with valid holder addenda in its own store (agent-fabric ADR-060 §5 rule 7). Absent is optional: a store with no addenda renders the shared prompt; required refuses the launch. Invalid or unverifiable addenda refuse it either way."
          }
        }
      }
    }
  }
}
