{
  "version": 1,
  "description": "The reusable roles agent-fabric knows: id (the slug that goes on the wire and names identities/roles/<id>/), title, a starting group, and whether the role is still a candidate. Path and keyword rules that say WHERE a role applies inside a managed repository are not here — they belong to projects/<project-id>/taxonomy.json. `groups` and each role's `group` are a starting layout for Fleet Deck, the operator's console over the fleet: what it seeds when first set up on a host. The operator arranges the deck as they like from then on; nothing re-applies or checks this.",
  "groups": [
    "C-Level",
    "Rust Developer",
    "Net Developer",
    "Python Developer",
    "Flutter Developer",
    "TypeScript Developer",
    "Experts",
    "Marketing",
    "Legal",
    "Accountants",
    "Infrastructure"
  ],
  "roles": [
    {
      "id": "architect-cto",
      "title": "Architect / CTO",
      "short_title": "Architect / CTO",
      "group": "C-Level"
    },
    {
      "id": "backend-dev",
      "title": ".NET backend developer",
      "short_title": "Backend Developer",
      "group": "Net Developer"
    },
    {
      "id": "brand-comms",
      "title": "Brand and communications",
      "short_title": "Brand Specialist",
      "group": "Marketing"
    },
    {
      "id": "db-admin",
      "title": "Database administrator",
      "short_title": "Database Administrator",
      "group": "Infrastructure"
    },
    {
      "id": "devex-tooling",
      "title": "Developer experience and repo tooling",
      "short_title": "DevEx Engineer",
      "group": "Infrastructure"
    },
    {
      "id": "domain-transit",
      "title": "Transit domain",
      "short_title": "Transit Domain Expert",
      "group": "Experts"
    },
    {
      "id": "edge-hosting",
      "title": "Domain, DNS, edge and hosting",
      "short_title": "Edge and Hosting Engineer",
      "group": "Infrastructure"
    },
    {
      "id": "fabric-coordinator",
      "title": "Control-plane coordinator (agent-fabric, and the GZCoord protocol)",
      "short_title": "Fabric Coordinator",
      "group": "C-Level"
    },
    {
      "id": "flutter-dev",
      "title": "Flutter developer",
      "short_title": "Flutter Developer",
      "group": "Flutter Developer"
    },
    {
      "id": "language-culture",
      "title": "Language, translation, localization and culture",
      "short_title": "Culture Specialist",
      "group": "Experts"
    },
    {
      "id": "legal-expert",
      "title": "Legal expert, one jurisdiction per holder (its addenda)",
      "short_title": "Legal Expert",
      "group": "Legal",
      "holders_specialize": "required"
    },
    {
      "id": "p2p-network-dev",
      "title": "Rust peer-to-peer networking developer",
      "short_title": "P2P Network Developer",
      "group": "Rust Developer"
    },
    {
      "id": "python-dev",
      "title": "Python developer",
      "short_title": "Python Developer",
      "group": "Python Developer"
    },
    {
      "id": "rust-services-dev",
      "title": "Rust network-services developer (proxies, gateways, streaming)",
      "short_title": "Rust Services Developer",
      "group": "Rust Developer"
    },
    {
      "id": "rust-ui-dev",
      "title": "Rust native-client developer (Slint, accessibility, local store)",
      "short_title": "Rust UI Developer",
      "group": "Rust Developer"
    },
    {
      "id": "ux-designer",
      "title": "User-experience designer: flows, interactions, accessibility, specified for the developer",
      "short_title": "UX Designer",
      "group": "Experts"
    },
    {
      "id": "web-dev",
      "title": "Web sub-app developer",
      "short_title": "Web Developer",
      "group": "TypeScript Developer"
    }
  ]
}
